{
  "schema_id": "project_live_workflow_manifest",
  "project_name": "manifest_live_workflow_fixture",
  "workbook_id": "workbook_fixture",
  "dashboard_ids": ["dashboard_fixture"],
  "target": {
    "workbook_id": "workbook_fixture",
    "dashboard_ids": ["dashboard_fixture"]
  },
  "workflows": [
    {
      "name": "dry_run_dashboard_change",
      "may_execute_command": false,
      "allow_publish": false,
      "affected_objects": [
        {"type": "workbook", "id": "workbook_fixture"},
        {"type": "dashboard", "id": "dashboard_fixture"}
      ],
      "expected_changed_object_groups": ["dashboards", "editor_charts"],
      "safe_constraints": {
        "save_first": true,
        "publish_default": false,
        "delete_move_permission_operations": false
      },
      "dry_run": {
        "command": ["python3", "scripts/live.py", "--dry-run"],
        "summary_path": "reports/dry_run_summary.json",
        "expected_artifacts": [
          "artifacts/validation/dashboard_payload_preflight.json",
          "artifacts/validation/editor_sql_lint.json",
          "artifacts/target_lock.json"
        ],
        "evidence_checks": [
          "dashboard_payload_preflight",
          "static_sql_lint",
          "readback",
          "target_evidence"
        ],
        "summary_requirements": {
          "branch_status": "dry_run",
          "required_fields": [
            "workbook_id",
            "dashboard_ids",
            "target_ids",
            "branch_status",
            "changed_object_counts",
            "evidence_paths"
          ],
          "changed_counts_required": true,
          "target_ids_required": true,
          "evidence_paths_required": true
        }
      }
    }
  ]
}
